[
  {
    "id": "gw-11e-crucible",
    "name": "Crucible of Battle",
    "source": "gw-11e",
    "deployment_pattern_id": "crucible-of-battle",
    "pieces": [
      {
        "id": "piece-1",
        "name": "11e Large Area",
        "piece_type": "area",
        "template": "area-large",
        "position": {
          "x": 48.25,
          "y": 8.5
        },
        "keystones": [
          {
            "edge": "right",
            "ref": {
              "kind": "vertex",
              "index": 1
            }
          },
          {
            "edge": "top",
            "ref": {
              "kind": "vertex",
              "index": 1
            }
          }
        ]
      },
      {
        "id": "piece-2",
        "name": "11e Long Line Area",
        "piece_type": "area",
        "template": "area-long-line",
        "position": {
          "x": 35.5939,
          "y": 9.5627
        },
        "rotation_degrees": 55,
        "keystones": [
          {
            "edge": "right",
            "ref": {
              "kind": "vertex",
              "index": 1
            }
          },
          {
            "edge": "top",
            "ref": {
              "kind": "vertex",
              "index": 1
            }
          }
        ]
      },
      {
        "id": "piece-3",
        "name": "11e Short Line Area",
        "piece_type": "area",
        "template": "area-short-line",
        "position": {
          "x": 30.9016,
          "y": 3.031
        },
        "rotation_degrees": 55,
        "keystones": [
          {
            "edge": "right",
            "ref": {
              "kind": "vertex",
              "index": 1
            }
          },
          {
            "edge": "top",
            "ref": {
              "kind": "vertex",
              "index": 1
            }
          }
        ]
      },
      {
        "id": "piece-4",
        "name": "Pipe",
        "piece_type": "feature",
        "footprint": {
          "type": "polygon",
          "points": [
            {
              "x": -1.0244,
              "y": -2.3347
            },
            {
              "x": 1.8435,
              "y": 1.7611
            },
            {
              "x": 1.0244,
              "y": 2.3347
            },
            {
              "x": -1.8435,
              "y": -1.7611
            }
          ]
        },
        "position": {
          "x": 31.0244,
          "y": 3.0847
        },
        "template": "pipe"
      },
      {
        "id": "piece-5",
        "name": "Pipe",
        "piece_type": "feature",
        "footprint": {
          "type": "polygon",
          "points": [
            {
              "x": -1.0244,
              "y": -2.3347
            },
            {
              "x": 1.8435,
              "y": 1.7611
            },
            {
              "x": 1.0244,
              "y": 2.3347
            },
            {
              "x": -1.8435,
              "y": -1.7611
            }
          ]
        },
        "position": {
          "x": 34.5244,
          "y": 7.5847
        },
        "template": "pipe"
      },
      {
        "id": "piece-6",
        "name": "Pipe",
        "piece_type": "feature",
        "footprint": {
          "type": "polygon",
          "points": [
            {
              "x": -1.0244,
              "y": -2.3347
            },
            {
              "x": 1.8435,
              "y": 1.7611
            },
            {
              "x": 1.0244,
              "y": 2.3347
            },
            {
              "x": -1.8435,
              "y": -1.7611
            }
          ]
        },
        "position": {
          "x": 37.0244,
          "y": 11.0847
        },
        "template": "pipe"
      },
      {
        "id": "piece-7",
        "name": "Gantry",
        "piece_type": "feature",
        "footprint": {
          "type": "polygon",
          "points": [
            {
              "x": 0.2456,
              "y": -1.3927
            },
            {
              "x": 1.3927,
              "y": 0.2456
            },
            {
              "x": -0.2456,
              "y": 1.3927
            },
            {
              "x": -1.3927,
              "y": -0.2456
            }
          ]
        },
        "position": {
          "x": 35.7544,
          "y": 9.3927
        },
        "template": "gantry"
      },
      {
        "id": "piece-8",
        "name": "11e Medium Area",
        "piece_type": "area",
        "template": "area-medium",
        "position": {
          "x": 45.0824,
          "y": 25.6046
        },
        "rotation_degrees": 55,
        "keystones": [
          {
            "edge": "right",
            "ref": {
              "kind": "vertex",
              "index": 1
            }
          },
          {
            "edge": "bottom",
            "ref": {
              "kind": "vertex",
              "index": 1
            }
          }
        ]
      },
      {
        "id": "piece-9",
        "name": "11e Short Line Area",
        "piece_type": "area",
        "template": "area-short-line",
        "position": {
          "x": 46.781,
          "y": 19.3484
        },
        "rotation_degrees": 325,
        "keystones": [
          {
            "edge": "right",
            "ref": {
              "kind": "vertex",
              "index": 1
            }
          },
          {
            "edge": "top",
            "ref": {
              "kind": "vertex",
              "index": 1
            }
          }
        ]
      },
      {
        "id": "piece-10",
        "name": "11e Large Area",
        "piece_type": "area",
        "template": "area-large",
        "position": {
          "x": 47.431,
          "y": 37.2176
        },
        "rotation_degrees": 55,
        "keystones": [
          {
            "edge": "right",
            "ref": {
              "kind": "vertex",
              "index": 1
            }
          },
          {
            "edge": "bottom",
            "ref": {
              "kind": "vertex",
              "index": 1
            }
          }
        ]
      },
      {
        "id": "piece-11",
        "name": "11e Medium Area",
        "piece_type": "area",
        "template": "area-medium",
        "position": {
          "x": 35.8324,
          "y": 34.3546
        },
        "rotation_degrees": 55,
        "keystones": [
          {
            "edge": "right",
            "ref": {
              "kind": "vertex",
              "index": 1
            }
          },
          {
            "edge": "bottom",
            "ref": {
              "kind": "vertex",
              "index": 1
            }
          }
        ]
      },
      {
        "id": "piece-12",
        "name": "11e Trapezoid Area",
        "piece_type": "area",
        "template": "area-trapezoid",
        "position": {
          "x": 31.15,
          "y": 24.2
        },
        "rotation_degrees": 90,
        "mirror": "horizontal",
        "link_group": "center",
        "keystones": [
          {
            "edge": "right",
            "ref": {
              "kind": "vertex",
              "index": 0
            }
          },
          {
            "edge": "bottom",
            "ref": {
              "kind": "vertex",
              "index": 0
            }
          }
        ]
      },
      {
        "id": "piece-13",
        "name": "11e Large Area",
        "piece_type": "area",
        "template": "area-large",
        "position": {
          "x": 11.75,
          "y": 35.5
        },
        "rotation_degrees": 180,
        "keystones": [
          {
            "edge": "left",
            "ref": {
              "kind": "vertex",
              "index": 1
            }
          },
          {
            "edge": "bottom",
            "ref": {
              "kind": "vertex",
              "index": 1
            }
          }
        ]
      },
      {
        "id": "piece-14",
        "name": "11e Long Line Area",
        "piece_type": "area",
        "template": "area-long-line",
        "position": {
          "x": 24.4061,
          "y": 34.4373
        },
        "rotation_degrees": 235,
        "keystones": [
          {
            "edge": "left",
            "ref": {
              "kind": "vertex",
              "index": 1
            }
          },
          {
            "edge": "bottom",
            "ref": {
              "kind": "vertex",
              "index": 1
            }
          }
        ]
      },
      {
        "id": "piece-15",
        "name": "11e Short Line Area",
        "piece_type": "area",
        "template": "area-short-line",
        "position": {
          "x": 29.0984,
          "y": 40.969
        },
        "rotation_degrees": 235,
        "keystones": [
          {
            "edge": "left",
            "ref": {
              "kind": "vertex",
              "index": 1
            }
          },
          {
            "edge": "bottom",
            "ref": {
              "kind": "vertex",
              "index": 1
            }
          }
        ]
      },
      {
        "id": "piece-16",
        "name": "Pipe",
        "piece_type": "feature",
        "footprint": {
          "type": "polygon",
          "points": [
            {
              "x": 1.0244,
              "y": 2.3347
            },
            {
              "x": -1.8435,
              "y": -1.7611
            },
            {
              "x": -1.0244,
              "y": -2.3347
            },
            {
              "x": 1.8435,
              "y": 1.7611
            }
          ]
        },
        "position": {
          "x": 28.9756,
          "y": 40.9153
        },
        "template": "pipe"
      },
      {
        "id": "piece-17",
        "name": "Pipe",
        "piece_type": "feature",
        "footprint": {
          "type": "polygon",
          "points": [
            {
              "x": 1.0244,
              "y": 2.3347
            },